{
  "executionId": "a1b2c3d4-e5f6-4789-8abc-1234567890ab",
  "modelId": "monte-carlo-v1",
  "matchup": {
    "homeTeamId": "b3b6c2a0-6e2a-4c1e-9d3a-1f2e3d4c5b6a",
    "awayTeamId": "1a2b3c4d-5e6f-4a7b-8c9d-0e1f2a3b4c5d",
    "season": 2025,
    "isNeutralSite": true
  },
  "dataSnapshotId": "season-2025-snapshot-2025-08-29",
  "executionKind": "SIMULATION",
  "configuration": {},
  "trials": 10000,
  "seed": 42
}
